{
  "schema_version": "0.1.0",
  "request_id": "request-2",
  "review_id": "review-2",
  "mode": "review",
  "created_at": "2026-10-01T12:06:00Z",
  "target": {
    "repository": "example-org/example-service",
    "pull_request_number": 42,
    "head_sha": "dddddddddddddddddddddddddddddddddddddddd",
    "base_sha": "bbbbbbbbbbbbbbbbbbbbbbbbbbbbbbbbbbbbbbbb",
    "base_ref": "main",
    "merge_base_sha": "cccccccccccccccccccccccccccccccccccccccc"
  },
  "context": {
    "documents": [
      {
        "source": {
          "source_id": "jira-description",
          "system": "jira",
          "uri": "https://jira.example.invalid/browse/EX-42",
          "observed_at": "2026-10-01T12:00:00Z",
          "type": "ticket"
        },
        "text": "Add a lookup endpoint. Invalid numeric identifiers must return HTTP 400."
      },
      {
        "source": {
          "source_id": "pr-description",
          "system": "github",
          "type": "pull_request",
          "uri": "https://github.com/example-org/example-service/pull/42",
          "observed_at": "2026-10-01T12:00:00Z",
          "actor": {
            "id": "user-1",
            "login": "author",
            "kind": "human",
            "is_pr_author": true
          }
        },
        "text": "Add the lookup endpoint required by EX-42. Test plan: CI plus manual invalid-identifier request."
      },
      {
        "source": {
          "source_id": "review-source-1",
          "system": "github",
          "type": "review",
          "uri": "https://github.com/example-org/example-service/pull/42#pullrequestreview-1",
          "observed_at": "2026-10-01T12:00:00Z",
          "actor": {
            "id": "bot-1",
            "login": "ai-reviewer",
            "kind": "bot",
            "is_pr_author": false
          }
        },
        "text": "AI review of the initial snapshot."
      },
      {
        "source": {
          "source_id": "100",
          "system": "github",
          "type": "review_comment",
          "uri": "https://github.com/example-org/example-service/pull/42#discussion_r100",
          "observed_at": "2026-10-01T12:00:00Z",
          "actor": {
            "id": "bot-1",
            "login": "ai-reviewer",
            "kind": "bot",
            "is_pr_author": false
          }
        },
        "text": "Invalid numeric identifiers return a server error. Finding: finding-11111111-1111-4111-8111-111111111111."
      },
      {
        "source": {
          "source_id": "author-reply",
          "system": "github",
          "type": "review_comment",
          "uri": "https://github.com/example-org/example-service/pull/42#discussion_rauthor-reply",
          "observed_at": "2026-10-01T12:00:00Z",
          "actor": {
            "id": "user-1",
            "login": "author",
            "kind": "human",
            "is_pr_author": true
          }
        },
        "text": "The route converter should reject non-numeric input before the handler. Please reassess finding-11111111-1111-4111-8111-111111111111."
      }
    ],
    "attachments": [],
    "pr": {
      "repository": "example-org/example-service",
      "number": 42,
      "title": "EX-42 Add lookup endpoint",
      "description": "Add the lookup endpoint required by EX-42. Test plan: CI plus manual invalid-identifier request.",
      "author": {
        "id": "user-1",
        "login": "author",
        "kind": "human",
        "is_pr_author": true
      },
      "state": "open",
      "draft": false,
      "source_id": "pr-description"
    },
    "jira_ticket": {
      "key": "EX-42",
      "title": "Add lookup endpoint",
      "description": "Add a lookup endpoint. Invalid numeric identifiers must return HTTP 400.",
      "source_id": "jira-description",
      "comments": []
    },
    "reviews": [
      {
        "review_id": "github-review-1",
        "source_id": "review-source-1",
        "author": {
          "id": "bot-1",
          "login": "ai-reviewer",
          "kind": "bot",
          "is_pr_author": false
        },
        "state": "COMMENTED",
        "commit_sha": "aaaaaaaaaaaaaaaaaaaaaaaaaaaaaaaaaaaaaaaa",
        "body": "AI review of the initial snapshot.",
        "submitted_at": "2026-10-01T12:00:00Z"
      }
    ],
    "review_threads": [
      {
        "thread_id": "thread-1",
        "review_id": "github-review-1",
        "is_resolved": false,
        "is_outdated": false,
        "comments": [
          {
            "comment_id": "100",
            "source_id": "100",
            "author": {
              "id": "bot-1",
              "login": "ai-reviewer",
              "kind": "bot",
              "is_pr_author": false
            },
            "body": "Invalid numeric identifiers return a server error. Finding: finding-11111111-1111-4111-8111-111111111111.",
            "created_at": "2026-10-01T12:00:00Z",
            "updated_at": "2026-10-01T12:00:00Z",
            "url": "https://github.com/example-org/example-service/pull/42#discussion_r100",
            "reply_to_comment_id": null,
            "review_id": "github-review-1",
            "thread_id": "thread-1"
          },
          {
            "comment_id": "author-reply",
            "source_id": "author-reply",
            "author": {
              "id": "user-1",
              "login": "author",
              "kind": "human",
              "is_pr_author": true
            },
            "body": "The route converter should reject non-numeric input before the handler. Please reassess finding-11111111-1111-4111-8111-111111111111.",
            "created_at": "2026-10-01T12:00:00Z",
            "updated_at": "2026-10-01T12:00:00Z",
            "url": "https://github.com/example-org/example-service/pull/42#discussion_rauthor-reply",
            "reply_to_comment_id": "100",
            "review_id": "github-review-1",
            "thread_id": "thread-1"
          }
        ]
      }
    ],
    "pr_comments": [],
    "sources": []
  },
  "config": {
    "project_id": "example-project",
    "config_version": "1",
    "setup": {
      "runtime_profile": "example-python",
      "python_version": "3.12",
      "install_commands": [
        "python -m pip install -r requirements.txt"
      ],
      "prepare_commands": [],
      "environment_secret_refs": [
        {
          "resource": "projects/example/secrets/dev-env/versions/1",
          "purpose": "Development-only repository environment"
        }
      ],
      "development_resources": []
    },
    "mandatory_lenses": [
      {
        "lens_id": "security",
        "version": "1",
        "instructions": "Inspect changes for authorization failures, unsafe input handling, and exposure of protected data. Use the PR diff as the scope boundary."
      }
    ],
    "custom_rules": [],
    "size_exclude_patterns": [
      "tests/**",
      "fixtures/**"
    ],
    "fixture_patterns": [
      "fixtures/**"
    ],
    "models": {
      "triage": {
        "model": "example-review-model",
        "effort": "high"
      },
      "reviewer_choices": [
        {
          "model": "example-review-model",
          "effort": "high"
        }
      ],
      "deduplication": {
        "model": "example-review-model",
        "effort": "high"
      },
      "verification": {
        "model": "example-review-model",
        "effort": "high"
      },
      "discussion": {
        "model": "example-review-model",
        "effort": "high"
      },
      "history_import": {
        "model": "example-review-model",
        "effort": "high"
      }
    },
    "limits": {
      "max_reviewers": 4,
      "max_concurrent_agents": 2,
      "stage_additional_attempts": 2,
      "quota_wait_seconds": 1800,
      "execution_timeout_seconds": 7200,
      "finalization_reserve_seconds": 120,
      "agent_attempt_timeout_seconds": {
        "triage": 600,
        "reviewer": 1800,
        "deduplication": 600,
        "verification": 1800,
        "discussion": 1200,
        "history_import": 1200
      }
    },
    "read_scope": {
      "repositories": [
        "example-org/example-service"
      ],
      "jira_projects": [
        "EX"
      ],
      "web_search": "live",
      "deltahub_projects": [
        "example-project"
      ]
    },
    "prompt_bundle_version": "1",
    "prompt_customizations": {},
    "github_command_handle": "@hubbot"
  },
  "credentials": {
    "codex_account_ref": "poc-owner",
    "codex_secret_ref": {
      "resource": "projects/example/secrets/codex-owner",
      "purpose": "Subscription credential reference; never prompt content"
    },
    "github_installation_id": "12345",
    "jira_credential_ref": {
      "resource": "projects/example/secrets/jira-reader",
      "purpose": "Jira service-account OAuth client ID and client secret; trusted worker only"
    },
    "github_app_id": "12345",
    "github_private_key_secret_ref": {
      "resource": "projects/example/secrets/github-app-key/versions/latest",
      "purpose": "GitHub App private key, trusted worker only"
    },
    "jira_auth": "oauth_client_credentials",
    "jira_cloud_id": "example-jira-cloud-id"
  },
  "output_prefix": "gs://example-private-review/review-2/",
  "baseline_report": {
    "artifact_id": "report-1",
    "kind": "report",
    "uri": "gs://example-private-review/review-1/reports/1.json",
    "generation": "1",
    "sha256": "37f89801f6dd18ad5f1bd06807567115681b24998dc17b86f0f1eb44d95c4fd9",
    "content_type": "application/json"
  },
  "discussion": null
}
